{
  "id": 1001,
  "issueDate": 1754064000000,
  "dueDate": 1756742400000,
  "service": {
    "description": "Software development services - Q3 2026",
    "quantity": 1,
    "price": 15000.00,
    "currency": {
      "name": "US Dollar",
      "cc": "USD",
      "symbol": "$"
    }
  },
  "companyInfo": {
    "name": "Ambush Tech Solutions LLC",
    "email": "contact@ambushtech.dev",
    "ownerName": "Theo L.M.",
    "cnpj": "12.345.678/0001-90",
    "address": {
      "street": "123 Tech Ave",
      "extraInfo": "Suite 400",
      "neighbourhood": "Downtown",
      "city": "San Francisco",
      "state": "CA",
      "country": "United States",
      "zipCode": "94105"
    }
  },
  "clientInfo": {
    "name": "GlobalClient Corp",
    "address": "456 Market St, San Francisco, CA 94105"
  },
  "bankInfo": {
    "beneficiaryName": "Theo L.M.",
    "main": {
      "iban": "US12345678901234567890",
      "swift": "BOFAUS3N",
      "bankName": "Bank of America",
      "bankAddress": "100 W 33rd St, New York, NY 10001"
    }
  }
}
